Spanish_text,English_text
"Salmonella enterica serovar Typhimurium (S. Typhimurium) es una bacteria patógena facultativa intracelular. Al igual que la mayoría de bacterias, su superficie celular está recubierta por una macromolécula denominada peptidoglicano, una estructura compuesta por largas cadenas glucídicas entrecruzadas por cadenas peptídicas. El estilo de vida patogénico de S. Typhimurium hace que esté sometida a condiciones de estrés en el hospedador. Tal y como ha sido descrito para otras macromoléculas de la envuelta como el lipopolisacárido, cambios en la estructura del peptidoglicano podrían beneficiar la adaptación a los cambios en el hospedador. Esta Tesis Doctoral supone la continuación de resultados previos de nuestro laboratorio y se ha centrado en el análisis de la regulación del metabolismo del peptidoglicano en S. Typhimurium ligada a la adaptación a un estilo de vida intracelular.En la primera parte de este trabajo se describe la proteína PBP3SAL, ausente en bacterias no patógenas, y que posee un 63 % de identidad con la proteína que une penicilina 3 (PBP3). Nuestros resultados demuestran que PBP3SAL promueve la división celular en pH ácido de forma independiente a PBP3. Los experimentos de infección de ratones BALB/c con S. Typhimurium confirman que el patógeno produce más PBP3SAL que PBP3.En este trabajo también se ha estudiado la proteína STM0497, presente solo en bacterias Gram-negativas patógenas. STM0497 controla los niveles de enzimas del metabolismo de peptidoglicano de S. Typhimurium, en especial la transglicosilasa lítica MltD.Además, la ausencia de STM0497 aumenta la virulencia de la bacteria cuando infecta ratones BALB/c, lo que sugiere un papel en el control de la tasa de crecimiento del patógeno en el hospedador.En el último capítulo de esta Tesis se describe una parada del metabolismo de peptidoglicano provocada por la adición de D-alaninol a cultivos de S. Typhimurium. El D-alaninol es un aminoalcohol que nuestro grupo de investigación detectó en el peptidoglicano de S. Typhimurium cuando reside en el interior de fibroblastos. Nuestras observaciones permiten postular un papel de este aminoalcohol en el control del crecimiento intracelular del patógeno.Los resultados obtenidos en esta Tesis doctoral muestran, por tanto, diferencias en el metabolismo de peptidoglicano cuando S. Typhimurium se adapta a un estilo de vida intracelular.","Salmonella enterica serovar Typhimurium (S. Typhimurium) is an intracellular facultative pathogen. Like most bacteria, its cell surface is covered by a macromolecule called peptidoglycan, a structure composed of long glycan chains cross-linked by short stem peptide chains. The pathogenic lifestyle of S. Typhimurium causes it to be subjected to stress conditions inside the host cell. Like other macromolecules such as lipopolysaccharide, modifications in the structure of peptidoglycan could benefit bacterial adaptation to changes in the host environment. This Thesis continues with previous results from our laboratory, focusing on the analysis of the regulation of peptidoglycan metabolism in S. Typhimurium that follows to an adaptation to an intracellular lifestyle.The first part of this work describes the protein PBP3SAL, absent in non-pathogenic bacteria, which has 63 % identity with penicillin-binding protein 3 (PBP3). Our results demonstrate that PBP3SAL promotes cell division at acidic pH independently of PBP3.Competition assays with BALB/c mice confirm that S. Typhimurium produces higher amounts of PBP3SAL than PBP3.We also studied the protein STM0497, which is present only in pathogenic Gram-negative bacteria. STM0497 controls the enzyme levels of peptidoglycan metabolism in S. Typhimurium, especially the lytic transglicosylase MltD. In addition, the absence of STM0497 increases the virulence of S. Typhimurium when it infects BALB/c mice, which suggests a role in controlling the growth rate of the pathogen inside the host.In the last chapter of this Thesis we describe a stop of peptidoglycan metabolism caused by the addition of D-alaninol to cultures of S. Typhimurium. D-alaninol is an aminoalcohol that our research group detected in peptidoglycan of S. Typhimurium when it resides inside fibroblasts. These observations allow us to postulate a role of this aminoalcohol controlling the intracellular growth of the pathogen.The results obtained in this work show differences in peptidoglycan metabolism when S. Typhimurium adapts to an intracellular lifestyle."
"RESUMEN El título de esta tesis da cuenta del ámbito de actuación en el que se inserta esta investigación, la Fonopragmática. Más específicamente, este trabajo de tesis se centra en el análisis y el estudio de los indicadores acústico-melódicos de la ironía verbal en la conversación espontánea, y en contexto, principalmente. En este sentido, la carencia de trabajos dedicados al estudio de la diversidad fónica como desencadenante de funciones pragmático-irónicas concretas, nos ha obligado a seguir indagando sobre la descripción analítica de un tono de voz irónico como parte de un proceso interpretativo metarrepresentacional complejo (Haverkate, 1985; Alba-Juez, 1995; Attardo, 2003; Bryant y Fox Tree, 2005; Alvarado, 2006; Ruiz Gurillo, 2009, 2010; Padilla, 2010; Becerra Valderrama, 2011b, 2012).Bajo esta motivación, nuestra propuesta investigadora parte de los llamados análisis interaccionistas, integrados grosso modo en el Análisis Conversacional americano, en la Etnografía de la Comunicación de Gumperz y en la Sociolingüística Interaccional de Goffman. Aunque los análisis interaccionistas se integran en un ámbito todavía novedoso para el estudio de la ironía, han comenzado a desarrollarse algunos trabajos centrados en factores derivados de las relaciones interpersonales y en diversos aspectos psicosociales presentes en la progresión conversacional (Jorgensen, 1996; Clift, 1999; Anolli y otros, 2001; Gibbs y Colston, 2001; Giora y Gur, 2003; Kotthof, 2003; Eisterhold y otros, 2006; Grupo GRIALE ). Los análisis puramente interaccionistas, basados en ejemplos reales, respaldan, pues, procesos inferenciales complejos, en cierta medida, debido a la multiplicidad de experiencias sociales y contextuales que se descubren tras el empleo de una lengua en interacción.Siguiendo esta perspectiva de tipo psicologista, se ha tratado de aportar una explicación objetiva de la ironía en interacción, vista como un fenómeno con múltiples funciones pragmático-irónicas concretas que se apoyan en indicadores y marcas lingüísticas, cinésicas, paralingüísticas y/o acústico-melódicas, capaces de guiar la correcta interpretación inferencial del significado irónico. Se ha fijado, además, una metodología experimental adecuada, considerando las ventajas y carencias metodológicas que lastran otras investigaciones previas sobre los valores pragmáticos de la entonación. Y, por último, se ha elaborado un trabajo empírico que ha supuesto la recogida de un corpus basado en series de televisión y de tertulias radiofónicas, que ha sido evaluado en tests de percepción discriminatorios y analizado acústicamente con el propósito de definir objetivamente la prosodia de la ironía.","ABSTRACT The title of this thesis of the account of the field of action in which this research is inserted, the linguistic branch of the Phonopragmatic. More specifically, this thesis work focuses on the analysis and study of acoustic-melody indicators of verbal irony in spontaneous conversation, and in context, mainly. In this sense, the lack of works devoted to the study of phonic diversity as a trigger for pragmatic-ironic functions to development, has forced us to follow the analytical description of tone of voice to tone as part of the complex metarepresentational interpretative process (Haverkate, 1985; Alba-Juez, 1995; Attardo, 2003; Bryant and Fox Tree, 2005; Alvarado, 2006; Ruiz Gurillo, 2009, 2010; Padilla, 2010; Becerra Valderrama, 2011b, 2012).Under this motivation, our research proposal starts from the so-called interactionist analysis, integrated into the American Conversational analysis, the Communication Ethnography of Gumperz and the Interactional Sociolinguistics of Goffman. Although interactionist analyzes are integrated into a field that has not yet been used for the study of irony, some works have been developed and focused on the factors of interpersonal relationships and the various psychosocial aspects present in conversational progress (Jorgensen, 1996; Clift, 1999; Anolli et al., 2001; Gibbs and Colston, 2001; Giora and Gur, 2003; Kotthof, 2003; Eisterhold et al., 2006; Group GRIALE ). The purely interactionist analysis, based on real examples, supported, as well as, complex inferential processes, to a certain extent, due to the multiplicity of social and contextual experiences that are discovered through the use of a language in interaction.Following this perspective of a psychologist, we have tried to provide an objective explanation of irony in interaction, seen as a phenomenon with multiple concrete pragmatic-ironic functions that rely on indicators and linguistic, kinesthetic, paralinguistic and acoustic-melodic marks, capable of guiding the correct inferential interpretation of the ironic meaning. In addition, an adequate experimental methodology has been established, considering the advantages and methodological shortcomings that halt the development of pragmatic investigations of an intonative nature. And, finally, an empirical work has been developed that has involved the collection of a corpus based on television series and radio talk shows, which has been evaluated in discriminatory perception tests, and analyzed formally and acoustically with the purpose of objectively defining the intonation of irony."
"Introducción. La Artritis Reumatoide (AR) produce destrucción articular irreversible, deterioro funcional, comorbilidad y muerte prematura. Los mejores resultados se consiguen con un inicio temprano de una estrategia de tratamiento por objetivos y un seguimiento estrecho que permitan controlar rápida y eficazmente el proceso inflamatorio. El Metotrexato es el fármaco modificador de la enfermedad (FAME) de primera elección, pero sólo la mitad de los pacientes responden satisfactoriamente en monoterapia y con frecuencia produce efectos secundarios. Los estudios que han explorado la contribución de la variabilidad genética a la variabilidad de la eficacia y toxicidad del MTX en AR muestran resultados muy variables y ausencia de un solo polimorfismo responsable.Objetivos. Explorar el efecto combinado de las características clínicas relacionadas con el paciente, la enfermedad y el tratamiento, y de diferentes polimorfismos genéticos vinculados con el transporte y vías metabólicas del MTX, sobre la respuesta terapéutica de este fármaco, en términos de eficacia y de seguridad, en una cohorte de pacientes de AR en tratamiento con MTX en monoterapia.Material y métodos. Estudio de casos y controles en una cohorte de pacientes con AR del Hospital de Mérida (2012-2015), en seguimiento protocolizado desde 1990 en la consulta monográfica de AR del Servicio de Reumatología que hubieran estado en tratamiento con MTX en monoterapia. Se definió eficacia, como una respuesta (baja actividad) y remisión mantenidas durante el seguimiento, según DAS28-PCR, y toxicidad como la aparición de algún acontecimiento adverso relacionado con MTX en cualquier momento. Se estudiaron los polimorfismos (SNPs) ABCB1 C3435T, GGH T16C, FPG G2782A, MTHFR C677T, MTHFR A1298C, AMPD1 C34T, ITPA C94A y ADA A534G, y variables relacionadas con el paciente, la enfermedad y el tratamiento.Resultados. Se incluyó un total de 301 pacientes (edad media al diagnóstico de 50 años y 75% mujeres, valor basal medio de DAS28-PCR de 4,5, deterioro basal de la función física en el 75%, erosiones óseas tempranas en el 50% y afectación extraarticular en 24%) representativos de una AR grave. La monoterapia fracasó en la mitad de los pacientes, generalmente por falta de eficacia, y la mitad presentó acontecimientos adversos relacionados con MTX, más frecuentemente gastrointestinales, neurológicos y hepáticos, que causaron la suspensión de MTX en una tercera parte de los casos y un 18% del total. La probabilidad de respuesta a metotrexato fue menor en mujeres, fumadores activos y pacientes con enfermedad más grave (mayor actividad basal, erosiones tempranas y manifestaciones extraarticulares), y con independencia de los determinantes clínicos, en los homocigotos para el alelo mutado (genotipo C/C) del SNP MTHFR_A1298C y en los portadores del haplotipo C-C de los polimorfismos T677C - A1298C de MTHFR (28,2%). La toxicidad global fue más frecuente en mujeres y pacientes con comorbilidad, menor edad y genotipo C/T del MTHFR_T677C. La hepática fue más frecuente con Mantoux positivo y genotipo G/G de ADA_A534G. Algunos SNPs mostraron un efecto protector para la toxicidad. El sexo se comportó como factor modificador.Conclusiones. La mayoría de los SNPs estudiados se han asociado con alguna medida de desenlace, aunque el tamaño del efecto es pequeño. Los estudios de asociación genética deben tener en cuenta el sexo de los pacientes y otras variables clínicas.","Methotrexate (MTX) is the first-choice treatment in rheumatoid arthritis (RA). There is a high variability in the therapeutic response. We conducted a case-control study nested in a cohort of 301 RA patients treated with MTX in monotherapy with the aim to explore the influence of clinical characteristics and different polymorphisms related to transport and metabolic pathways of MTX on the therapeutic response. The outcome variables were the response (low activity and remission measured by DAS28PCR) and MTX toxicity. We studied the SNPs ABCB1_C3435T, GGH_T16C, FPG_G2782A, MTHFR_C677T, MTHFR_A1298C, AMPD1_C34T, ADA_A534G and ITPA_C94A, and variables related to the patient, the disease and the treatment. In a cohort representative of severe RA, half of the patients, especially women, smokers and with more baseline severity, did not reach a sufficient response with monotherapy. Adverse events, gastrointestinal, neurological and hepatic mainly, were recorded in 50% of patients, which caused the suspension of MTX in an 18% of the total. Toxicity was associated to women, younger age and comorbidity. Most of the SNPs studied have been associated with some outcome measure, highlighting the association of MTHFR_1298ACc with poor response and MTHFR_677TCc with good response. Some SNPs showed a protective effect for toxicity, but, in general, they were frequently associated with global (MTHFR_677CTc, GGH_16TCc) and hepatic (MTHFR_1298ACc, ADA_534AGc) toxicity, especially in men. Genetic association studies should take into account the sex of patients and other clinical variables. Smoking is the main modifiable risk factor of MTX response."
"La β-fructofuranosidasa XdINV de la levadura Xanthophyllomyces dendrorhous es una proteína extracelular altamente glicosilada que cataliza la liberación de fructosas de sustratos como sacarosa y rafinosa, además de sintetizar neo-fructooligosacáridos, compuestos en los que enlaces β(2-6) conectan unidades de fructosa a la glucosa de una sacarosa, interesantes en la industria alimentaria por sus características prebióticas.En este trabajo se desarrolló un efectivo sistema de expresión heteróloga basado en Pichia pastoris, que fue escalado a nivel de fermentador y permitió obtener grandes cantidades de proteína con características bioquímicas y sintéticas muy similares a las del productor natural. A su vez, el sistema desarrollado constituyó una gran herramienta para la fácil manipulación de la secuencia génica responsable de XdINV, que se usó con el objetivo de ahondar en el análisis estructural de la proteína mediante mutagénesis dirigida. El estudio por RMN de los cristales proteicos obtenidos confirmó la estructura dimérica de XdINV, cuyos monómeros presentaban la arquitectura típica de la familia 32 de las glicosilhidrolasas. Sin embargo, la proteína mostró un inusual patrón de dimerización regido por la presencia de numerosos restos glucídicos unidos a residuos de asparaginas localizados en la interfase dimérica y una larga extensión del extremo C-terminal de la proteína, no observada en otras proteínas de la familia. La obtención de diferentes variantes mutagénicas de XdINV, así como la de diversos complejos cristalográficos con diferentes sustratos, permitió señalar la importancia del residuo Trp105 y el bucle flexible TIV en la actividad y especificidad enzimática de XdINV, así como identificar hasta 4 subsitios de reconocimiento de sustratos. Además, las características topológicas del centro activo de la proteína le permitieron albergar una gran cantidad de compuestos, siendo capaz de fructosilar diversos azúcares, polialcoholes y hasta algunos derivados fenólicos, de los cuales se purificaron e identificaron el trisacárido neoerlosa, obtenido por la modificación de maltosa, dos isómeros del hidroxitirosol fructosilado y la fructosil-hidroquinona.Por último, se plantearon diferentes estrategias de inmovilización de XdINV con el objetivo de aprovechar el gran potencial de esta enzima a nivel industrial. De entre ellas, el biocatalizador generado por atrapamiento en hidrogeles de polivinil alcohol mostró las mejores características en cuanto estabilidad operacional y formación de FOS","The β-fructofuranosidase XdINV from the Xanthophyllomyces dendrorhous yeast is a highly glycosylated extracellular protein that catalyzes the release of fructose from substrates such as sucrose and raffinose. In addition, XdINV synthesizes neo-fructooligosaccharides, compounds with β(2-6) linkage connecting fructose units to the glucosyl moiety of sucrose, which are interesting in the food industry for its prebiotic characteristics.In this work, an effective heterologous expression system based on Pichia pastoris was developed to obtain large amounts of the studied protein using fed-batch fermentation. The heterologous protein holds similar characteristics to the one synthetized by the natural producer. Besides, the developed system established an essential tool for an easier manipulation of the XdINV gene in order to deepen the protein structural analysis through directed mutagenesis. The NMR study of the protein crystals confirmed the dimeric structure of XdINV, whose monomers presented the typical architecture of the glycosylhydrolases family 32. However, the protein showed an unusual pattern of dimerization governed by the presence of glycans linked to asparagine residues at the dimer interface and a long extension of the protein C-terminus, not observed in other proteins of the family. The different mutagenic variants of XdINV and the crystallographic complexes with diverse substrates highlighted the importance of the Trp105 residue and the TIV flexible loop in the activity and specificity of this enzyme, and identified up to 4 subsites of substrate recognition. In addition, the topological characteristics of the XdINV active site allowed to accommodate a large number of compounds, being able to fructosylate multiple sugars, polyalcohols and even phenolic compounds, from which the trisaccharide neoerlose (obtained by maltose modification), two isomers of the fructosylated hydroxytyrosol and fructosyl-hydroquinone were identified.Finally, different immobilization strategies of XdINV were proposed to exploit the vast industrial potential of this enzyme. Among them, the biocatalyst generated by entrapment in polyvinyl alcohol hydrogels showed the best characteristics in terms of operational stability and FOS formation."
"Los linfocitos o células B son esenciales en la respuesta inmune frente a patógenos, dando lugar a la respuesta adaptativa humoral en la que se generan células productoras de anticuerpo (células plasmáticas) y células B de memoria. Para ello, han de encontrar y reconocer antígeno específico a través del receptor de células B (B cell receptor, BCR). Las células B también son capaces de responder a estímulos de tipo innato, como los patrones moleculares asociados a patógenos (PAMP) a través de los receptores de tipo Toll (Toll-like receptors, TLR). La proteína tirosina kinasa de Bruton (Bruton´s tyrosine kinase, Btk) tiene un papel crucial en las rutas de señalización del BCR, receptores de quimioquinas y TLR, todos ellos esenciales para la respuesta de las células B.Dada su implicación en inmunodeficiencias, leucemias/linfomas y autoinmunidad, Btk se estudia intensamente y es diana terapéutica para el tratamiento de estas enfermedades.En esta tesis doctoral, estudiamos el papel de las funciones adaptadora y kinasa de Btk en la motilidad de las células B en respuesta a CXCL13, la formación de la sinapsis inmune y activación en respuesta a antígeno, y en la respuesta a estímulos de tipo innato (LPS, CpG) de células B. Para ello, utilizamos una línea de células B, células B primarias aisladas de distintos modelos animales, inhibidores farmacológicos de la actividad kinasa de Btk (ibrutinib, acalabrutinib), y células B humanas aisladas de pacientes con inmunodeficiencia ligada al cromosoma X (X-linked agammaglobulinemia, XLA). Los datos obtenidos indican que ambas actividades adaptadora y kinasa de Btk son esenciales para la motilidad de las células B mediada por la integrina LFA-1 en respuesta a CXCL13. En la formación de la sinapsis inmune, Btk tiene distintas funciones: 1) la función adaptadora regula la capacidad de las células B para formar la sinapsis inmune así como su correcto ensamblaje; 2) la actividad kinasa de Btk controla la cantidad de antígeno acumulada en la sinapsis a través del eje PLCg2/Ca2+ .Defectos tanto en la función adaptadora como en la actividad kinasa de Btk alteran la polarización del centro organizador de microtúbulos (MTOC) a la sinapsis, la activación y la proliferación de las células B. En respuesta a LPS o CpG, tanto la función adaptadora como la catalítica de Btk controlan la proliferación, el cambio de clase de inmunoglobulina y la producción de citoquinas en células B. La pre-estimulación de células B con LPS o CpG no alteró la quimiotaxis ni haptotaxis en respuesta a CXCL12, pero sí aumentó la capacidad de agregación de antígeno en la sinapsis inmune, corrigiendo el defecto causado por la falta de actividad kinasa en Btk.","B lymphocytes or B cells are essential players in the immune response against pathogens giving rise to the adaptive humoral immune response, where they differentiate into antibody secreting cells (or plasma cells) and memory B cells. For that, they need to encounter with their specific antigen through the B cell receptor (BCR). B cells are also able to respond to innate stimuli, such as the pathogen associated molecular patterns (PAMP) through the toll-like receptors (TLR). Bruton’s tyrosine kinase (Btk) has a crucial role in the signaling pathways downstream essential receptors for the B cell response, such as the BCR, TLR and chemokine receptors. Given its implication in immunodeficiencies, leukemias/lymphomas and autoimmunity, Btk is intensily studied and is a therapeutic target for the treatment of these diseases.In this doctoral thesis, we study the role of Btk shuttling/scaffold and kinase activities in CXCL13-triggered B cell motility, antigen-triggered B cell immune synapse formation and activation and in the B cell response to innate stimuli (LPS, CpG). To do this, we used a mouse B cell line, primary B cells from distinct mouse models, pharmacological inhibitors (Ibrutinib, acalabrutinib) and human B cells isolated from patients with X-linked agammaglobulinemia (XLA). Our data shows that both Btk shuttling/scaffold and kinase activities are essential for LFA-1 mediated B cell migration in response to CXCL13. In the immune synapse formation, Btk has different roles: 1) Btk shuttling/scaffold function regulates the B cell ability to trigger immune synapse formation as well as its appropriate molecular assembly; 2) Btk-kinase activity regulate the amount of antigen accumulated in the immune synapse through the PLCg2/Ca2+ axis. Impaired Btk membrane recruitment or kinase function likewise alters microtubule-organizing center (MTOC) polarization to the immune synapse, B cell activation and proliferation. In response to LPS or CpG, both Btk shuttling/scaffold and kinase activities control B cell proliferation, immunoglobulin class-switching and cytokine production. LPS or CpG B cell pre-stimulation does not alter the chemotaxis or haptotaxis in response to CXCL12, but increases the antigen-gathering capacity at the immune synapse, correcting the defects of Btk kinase-inactive B cells."
