Spanish_text,English_text
"El anticuerpo monoclonal anti-IgG1 cetuximab es una terapia que bloquea al receptor EGFR de las células tumorales, lo que le convierte en una terapia eficaz debido al bloqueo de la ruta molecular de las MAPK responsable de la proliferación y supervivencia celular. Además, este fármaco posee la capacidad de activar la citotoxicidad celular mediada por anticuerpo (ADCC) desencadenada por las células NK del propio paciente. Lo interesante de activar la ADCC, es que este mecanismo es independiente de las mutaciones activadoras tanto de KRAS y BRAF, como de cualquier otra activación de la ruta de las MAPK por debajo del EGFR. Uno de los factores que van a determinar una mayor interacción con la fracción constante del anticuerpo cetuximab es el tipo de polimorfismo presente en el receptor de la fracción constante de las inmunoglobulinas presentes en la membrana de las células efectoras, en concreto FcyRIIa y FcyRIIIa. Además, sabemos que existen otros receptores en las células NK conocidos como receptores KIR. No todos los receptores KIR son activadores de la función de las células NK ya que estas moléculas son polimórficas. Por esta razón, nos planteamos estudiar que polimorfismos tanto en los receptores FcγR como en los genes KIR serían buenos marcadores predictivos de una mayor respuesta al cetuximab a través de la activación de la ADCC. Para ello, diseñamos un ensayo clínico multicéntrico en el que reclutamos 70 muestras de pacientes con cáncer colorrectal metastásico con mutación de KRAS, expresión del EGFR y con el polimorfismo favorable FcγRIIa-131H/R que fueron tratados con cetuximab. Sobre estas muestras evaluamos la expresión de los polimorfismos en el gen de FcyRIIIa y en los genes KIR. Tras evaluar los polimorfismos de FcγRIIIa (V158F, V158V y F158F) en nuestra cohorte de pacientes, no encontramos asociación con la supervivencia de los pacientes tratados con cetuximab. Sin embargo, encontramos una alta tendencia hacia la significancia con respecto a la supervivencia global asociada al gen KIR2DS4 (P=0.071). Profundizando en las variantes del gen KIR2DS4, encontramos que la variante completa (KIR2DS4-full) presentaba un peor pronóstico comparada con la variante con el receptor no funcional (KIR2DS4-RNF) (P=0.030).Posteriormente, diseñamos un modelo in vitro para validar la asociación entre los polimorfismos favorables encontrados y la capacidad de activación de la ADCC de las células NK mediante el cetuximab. Para ello, co-cultivamos la línea celular derivada de cáncer colorrectal con mutación de KRAS, LS147T, junto a células NK aisladas de donantes sanos positivas para los polimorfismos favorables descritos previamente. Interesantemente, los genotipos favorables con FcγRIIa-131(H/H ó H/R) y la variante delecionada que resulta en un receptor no funcional, KIR2DS4del, presentaron una mayor tasa de activación de ADCC mediada por el anticuerpo cetuximab.","The anti-IgG1 monoclonal antibody cetuximab is a therapy that blocks the EGFR receptor of tumor cells. This treatment is an effective anti-neoplasic therapy to block the MAPK molecular pathway involved in cell proliferation and survival. In addition, this drug is able to activate antibody dependent cellular cytotoxicity (ADCC) triggered by NK cells. Interestingly, ADCC mechanism is independent of both KRAS and BRAF activating mutations, and other activating factors of the MAPK pathway downstream EGFR. One of the factors that could determine the interaction between cetuximab´s IgG1 constant fraction is the polymorphism expressed in the cell membrane of effector T-cells called gamma chain receptor of immunoglobulin constant fraction receptor of the immunoglobulins (FcγRIIa and FcγRIIIa). In fact, it is know that in NK cells there are other receptors known as KIR receptors. Not all KIR receptors are activators of NK cell function since these molecules are polymorphic. For this reason, we based our study on the polymorphisms expressed in FcγR and KIR and dissected whether they could be good predictive markers of cetuximab response through ADCC activation. For this, we designed a multicentre clinical trial and recruited 70 samples from patients with metastatic colorectal cancer with KRAS mutation, EGFR expression and the previously described FcγRIIa-131H/R polymorphism as favorable for cetuximab response. On these samples, we evaluated the expression of the polymorphisms in FcγRIIIa and in the KIR genes. After evaluating the polymorphisms of FcγRIIIa (V158F, V158V and F158F) in our patient cohort, we found no association with patient survival after cetuximab treatment. However, we found a high trend towards significance between overall survival and KIR2DS4 (P = 0.071). Further research on this gene revealed that full variant (KIR2DS4-full) showed a worse prognosis compared to the variant with the non-functional receptor (KIR2DS4-RNF) (P = 0.030).Subsequently, we designed an in vitro model to validate the association between the favorable polymorphisms previously found, and the activation of ADCC by cetuximab. Then, we cocultured a colorectal cancer derived cell line that carries KRAS mutation, LS147T, together with NK cells isolated from healthy donors tested to be positive for favorable polymorphisms.Interestingly, FcγRIIa-131 (H/H or H/R), and the deleted variant gene that translate a nonfunctional receptor, KIR2DS4del, showed a higher activation rate of ADCC mediated by cetuximab antibody."
"El anticuerpo monoclonal anti-IgG1 cetuximab es una terapia que bloquea al receptor EGFR de las células tumorales, lo que le convierte en una terapia eficaz debido al bloqueo de la ruta molecular de las MAPK responsable de la proliferación y supervivencia celular. Además, este fármaco posee la capacidad de activar la citotoxicidad celular mediada por anticuerpo (ADCC) desencadenada por las células NK del propio paciente. Lo interesante de activar la ADCC, es que este mecanismo es independiente de las mutaciones activadoras tanto de KRAS y BRAF, como de cualquier otra activación de la ruta de las MAPK por debajo del EGFR. Uno de los factores que van a determinar una mayor interacción con la fracción constante del anticuerpo cetuximab es el tipo de polimorfismo presente en el receptor de la fracción constante de las inmunoglobulinas presentes en la membrana de las células efectoras, en concreto FcyRIIa y FcyRIIIa. Además, sabemos que existen otros receptores en las células NK conocidos como receptores KIR. No todos los receptores KIR son activadores de la función de las células NK ya que estas moléculas son polimórficas. Por esta razón, nos planteamos estudiar que polimorfismos tanto en los receptores FcγR como en los genes KIR serían buenos marcadores predictivos de una mayor respuesta al cetuximab a través de la activación de la ADCC. Para ello, diseñamos un ensayo clínico multicéntrico en el que reclutamos 70 muestras de pacientes con cáncer colorrectal metastásico con mutación de KRAS, expresión del EGFR y con el polimorfismo favorable FcγRIIa-131H/R que fueron tratados con cetuximab. Sobre estas muestras evaluamos la expresión de los polimorfismos en el gen de FcyRIIIa y en los genes KIR. Tras evaluar los polimorfismos de FcγRIIIa (V158F, V158V y F158F) en nuestra cohorte de pacientes, no encontramos asociación con la supervivencia de los pacientes tratados con cetuximab. Sin embargo, encontramos una alta tendencia hacia la significancia con respecto a la supervivencia global asociada al gen KIR2DS4 (P=0.071). Profundizando en las variantes del gen KIR2DS4, encontramos que la variante completa (KIR2DS4-full) presentaba un peor pronóstico comparada con la variante con el receptor no funcional (KIR2DS4-RNF) (P=0.030).Posteriormente, diseñamos un modelo in vitro para validar la asociación entre los polimorfismos favorables encontrados y la capacidad de activación de la ADCC de las células NK mediante el cetuximab. Para ello, co-cultivamos la línea celular derivada de cáncer colorrectal con mutación de KRAS, LS147T, junto a células NK aisladas de donantes sanos positivas para los polimorfismos favorables descritos previamente. Interesantemente, los genotipos favorables con FcγRIIa-131(H/H ó H/R) y la variante delecionada que resulta en un receptor no funcional, KIR2DS4del, presentaron una mayor tasa de activación de ADCC mediada por el anticuerpo cetuximab.","The anti-IgG1 monoclonal antibody cetuximab is a therapy that blocks the EGFR receptor of tumor cells. This treatment is an effective anti-neoplasic therapy to block the MAPK molecular pathway involved in cell proliferation and survival. In addition, this drug is able to activate antibody dependent cellular cytotoxicity (ADCC) triggered by NK cells. Interestingly, ADCC mechanism is independent of both KRAS and BRAF activating mutations, and other activating factors of the MAPK pathway downstream EGFR. One of the factors that could determine the interaction between cetuximab´s IgG1 constant fraction is the polymorphism expressed in the cell membrane of effector T-cells called gamma chain receptor of immunoglobulin constant fraction receptor of the immunoglobulins (FcγRIIa and FcγRIIIa). In fact, it is know that in NK cells there are other receptors known as KIR receptors. Not all KIR receptors are activators of NK cell function since these molecules are polymorphic. For this reason, we based our study on the polymorphisms expressed in FcγR and KIR and dissected whether they could be good predictive markers of cetuximab response through ADCC activation. For this, we designed a multicentre clinical trial and recruited 70 samples from patients with metastatic colorectal cancer with KRAS mutation, EGFR expression and the previously described FcγRIIa-131H/R polymorphism as favorable for cetuximab response. On these samples, we evaluated the expression of the polymorphisms in FcγRIIIa and in the KIR genes. After evaluating the polymorphisms of FcγRIIIa (V158F, V158V and F158F) in our patient cohort, we found no association with patient survival after cetuximab treatment. However, we found a high trend towards significance between overall survival and KIR2DS4 (P = 0.071). Further research on this gene revealed that full variant (KIR2DS4-full) showed a worse prognosis compared to the variant with the non-functional receptor (KIR2DS4-RNF) (P = 0.030).Subsequently, we designed an in vitro model to validate the association between the favorable polymorphisms previously found, and the activation of ADCC by cetuximab. Then, we cocultured a colorectal cancer derived cell line that carries KRAS mutation, LS147T, together with NK cells isolated from healthy donors tested to be positive for favorable polymorphisms.Interestingly, FcγRIIa-131 (H/H or H/R), and the deleted variant gene that translate a nonfunctional receptor, KIR2DS4del, showed a higher activation rate of ADCC mediated by cetuximab antibody."
"La reentrada en ciclo celular en neuronas y la disfuncionalidad sináptica son dos eventos observados en las primeras etapas de la enfermedad de Alzheimer (Alzheimer’s disease, AD). La existencia de mecanismos moleculares compartidos entre ambos procesos sugiere una fuerte conexión entre el control del ciclo celular en neuronas “postmitóticas” y la regulación de la actividad y plasticidad sináptica, pudiendo ser la desregulación de ambos eventos clave para el desarrollo la patología. Con objeto de explorar esta cuestión, en este trabajo se presenta un modelo in vitro en el que se reactiva el ciclo en neuronas corticales mediante la expresión del antígeno T del SV40. La reactivación de ciclo derivó en hiperploidización de las neuronas, las cuales sufrieron una muerte progresiva y retardada, tal y como se ha observado en neuronas con contenido mayor al diploide en AD. Aquellas neuronas que reactivaron la maquinaria de ciclo presentaron una disminución en la frecuencia de generación de potenciales de acción, así como una menor actividad espontánea, siendo perfiles que correlacionan con una pérdida progresiva del segmento inicial del axón y de densidad de la proteína estructural PSD-95. La despolarización de la membrana en presencia de alto potasio fue capaz de mantener la densidad de PSD-95 y recuperar parcialmente la actividad sináptica espontánea, así como prevenir la muerte neuronal. En conjunto, los resultados sugieren la capacidad de las neuronas que han reentrado en ciclo de mantenerse integradas en circuitos activos a pesar de no ser funcionalmente activas. Para testar el impacto funcional de esta hipótesis, se desarrolló un modelo in sílico de red neuronal en el que se observó cómo la presencia de neuronas hiperploides es capaz de alterar diferencialmente la frecuencia de disparo en distintas poblaciones y las oscilaciones generadas. Con todo ello, el presente trabajo propone que la reentrada en ciclo en neuronas diferenciadas podría contribuir a la deficiencia cognitiva presente en los primeros estadios de AD así como a la vulnerabilidad de degeneración en las últimas etapas.","Cell cycle reentry and synaptic failure are two early indicators of Alzheimer’s disease (AD). The presence of common molecular mechanisms between both processes suggests a strong connection between cell cycle’s control in postmitotic neurons and synaptic activity and plasticity. A potential deregulation in both events could be key for the development of the pathology. To address this question, this work presents an in vitro model in which cultured cortical neurons are induced to reenter the cell cycle by expressing SV40 Large T antigen. Cell cycle re-entry was followed by hyperploidy in cortical neurons, which resulted in delayed cell death, as previously observed in AD-affected hyperploid neurons. Neurons that reactivated cell cycle showed diminished spike generation and reduced spontaneous synaptic activity, which correlated with progressive axon initial segment loss and reduced density of dendritic PSD-95 puncta. Membrane depolarization by high extracellular potassium maintained PSD-95 puncta density and partially rescued both spontaneous synaptic activity and cell death. This suggests that AD associated neurons which have reactivated cell cycle can be sustained in vivo if integrated in active neuronal circuits whilst promoting synaptic dysfunction. To test the functional effects of this hypothesis, an in silico neural network model was developed. The results showed how the presence of hyperploid neurons is able to differentially alter distinct neuronal populations’s firing rate and the generated oscillations. Thus, cell cycle reentry in neurons might contribute to cognitive mpairment in early stages of AD and neuronal death susceptibility at later stages."
"El carbono (C) y el nitrógeno (N) son dos nutrientes esenciales para el crecimiento y desarrollo de la planta. Los metabolismos de estos dos elementos se encuentran estrechamente coordinados y sometidos a una compleja regulación dentro de la célula. En este sentido, el estado redox cellular constituye uno de los principales integradores del metabolismo, incluyendo modificaciones post-traduccionales sobre enzimas diana mediante intercambios ditiol/disulfuro llevados a cabo por las tiorredoxinas (Trxs). En los cloroplastos actúan dos sistemas Trx en paralelo: (i) el sistema ferredoxina (Fd)-Trx en el que la Fd reducida durante la fotosíntesis transmite los electrones a la Fd-Trx reductasa, que a su vez reduce a las Trxs; (ii) el sistema formado por la Trx reductasa tipo C dependiente de NADPH (NTRC), que contiene en un mismo polipéptido un dominio Trx reductasa y un dominio Trx. NTRC es reducida tanto por el NADPH proveniente de las reacciones dependientes de la luz, como por el generado en la ruta oxidativa de las pentosas fosfato en oscuridad. Esta tesis doctoral se ha centrado en el papel regulador ejercido por las Trxs plastidiales f, m y NTRC en el metabolismo del cloroplasto.","Carbon (C) and nitrogen (N) are two essential nutrients required for plant growth and development. The cellular metabolism of both elements is tightly coordinated and subjected to a complex regulation. In this regard, the redox status operates as a major integrator of cellular metabolism, involving post-translational modifications of target enzymes by thiol-disulfide exchanges exerted by thioredoxins (Trxs). In plant chloroplasts two Trx systems function in parallel: (i) the ferredoxin (Fd)-Trx system that depends on photosynthetically reduced Fd to supply electrons to the Fd-Trx reductase, which in turn reduces Trxs; (ii) the NADPH dependent Trx reductase type C (NTRC) that contains both a Trx-reductase and a Trx domain in a single polypeptide. NTRC is reduced by NADPH, which in addition to the light reactions, is also produced in the oxidative pentose phosphate pathway in darkness. This PhD thesis has been focused on the regulatory role of plastid Trx f, m and NTRC in chloroplast metabolism."
"La técnica más comúnmente empleada en el estudio del cerebro es el uso de modelos animales ex vivo de ratón pero estos modelos no suelen predecir con precisión las reacciones de los medicamentos para tratar a los pacientes humanos. Como solución, se propone el desarrollo de un modelo neuronal in vitro de origen humano que simule la fisiología y funcionalidad del tejido cerebral humano necesario para obtener resultados preclínicos más representativos. Sin embargo, los modelos in vitro existentes están limitados por una reproducibilidad estocástica entre lotes experimentales.Por tanto, el principal desafío de esta investigación se basa en el desarrollo y caracterización de una prueba de concepto para un modelo neuronal in vitro con una reproducibilidad de diferenciación celular mejorada. Para ello, se fabricaron y caracterizaron nuevas membranas planas poliméricas de poli(ε-caprolactona) (PCL) funcionalizadas con nanomateriales basados en grafeno, en particular oxido de grafeno (GO) y oxido de grafeno reducido (rGO), con una elevada porosidad para actuar como soportes celulares dentro de biorreactores de perfusión.Los resultados demostraron que la incorporación de los nanomateriales de rGO en la matriz polimérica aportaba unas propiedades significativamente mejoradas para la modulación de la diferenciación neuronal por lo que las membranas de PCL/rGO se consideran unos materiales prometedores para desarrollar modelos neuronales in vitro reproducibles.","The most commonly employed technique for studying the brain is the use of mouse ex vivo animal models. However, animal models usually fail to accurately predict drug reactions for treating human patients. As a solution, researchers propose the development of an in vitro neural model of human origin with the target of mimicking the physiology and functionality of human brain tissues, as a way to obtain more representative results. Nevertheless, the existing in vitro models are limited by the high stochastic reproducibility from experimental batches.Therefore, the main challenge of this research is based on the development and characterization of the proof of concept for an in vitro neural model with improved reproducible differentiation. To do this, polymeric poly(ε-caprolactone) (PCL) membranes functionalized with graphene based nanomaterials (graphene oxide (GO) and reduced graphene oxide (rGO)) with high porosity were fabricated and characterized to act as cell support in perfusion bioreactors.The results demonstrated that the incorporation of rGO nanomaterials in the polymeric matrix offered significant improved properties to modulate the neural differentiation. Therefore, PCL/rGO membranes were considered promising materials to develop reproducible in vitro neural models."
"Palabras clave: Evaluación de competencias, enfermero interno residente (EIR), enfermería del trabajo.Resumen: El programa formativo de la especialidad de Enfermería del Trabajo, que fue aprobada por el RD 450/2005 de 22 de abril, se desarrolla en unidades docentes acreditadas para dicha formación y se publica en la Orden SAS/1348/2009, de 6 de mayo. En dicho programa se describe el ámbito de actuación, los objetivos, competencias, duración de la formación, metodología de aprendizaje y actividades mínimas a realizar con evaluación formativa continua, anual y final, pero no contempla, ni sugiere los instrumentos de evaluación que permitan evidenciar la adquisición de dichas competencias. Existe un instrumento validado para la evaluación de las competencias del Grado en Enfermería, la ¿Escala ECOEnf¿, que se ha adaptado a otras especialidades y se tomó como referencia, así como el método para su diseño y validación, para proceder a su adaptación con el objetivo de disponer de una herramienta que permita evaluar las competencias del enfermero interno residente (EIR) de esta especialidad, contando con expertos especialistas en enfermería del trabajo, mediante técnicas de consenso y aplicando coeficientes de validación. El resultado final es la Escala ¿ECOEnfTRA¿, un instrumento de evaluación, compuesto por ocho subescalas, con criterios y niveles de logro, así como por el ¿nivel mínimo de logro exigible¿ para cada uno de ellos y para cada año de formación. Se ha conseguido validez de contenido y fiabilidad interna de las rúbricas que componen la escala ¿ECOEnfTRA¿ y consenso para el nivel de logro mínimo exigible, que deben demostrar los EIR al finalizar cada año de residencia. Se aporta, además, una propuesta de aplicación de dicha escala. Se trata de un instrumento específico para estas competencias, que viene a complementar la propuesta de evaluación general que recoge la Resolución de 21 de marzo de 2018, de la Dirección General de Ordenación Profesional.","Keywords: Competence assessment, Resident Nursing Intern (NRI), occupational health nursing.Abstract: The training programme of the major in Occupational Health Nursing, which was approved by RD 450/2005 of 22nd April, is carried out in teaching units accredited for this training and is published in Order SAS/1348/2009 of 6th May. This programme describes the scope of action, objectives, competences, duration of training, learning methodology and minimum activities to be carried out with continuous, annual and final formative evaluation, but does not cover or suggest the evaluation tools that allow the acquisition of these competences to be evidenced. There is a validated instrument for the evaluation of the competences of the Degree in Nursing¿ the ""ECOEnf Scale"". This instrument has been adapted to other majors and was taken as a reference, as well as the method for its design and validation, in order to perform its adjustment with the aim of having a tool enabling the evaluation of the competences of the Resident Nursing Intern (RNI) of this major, with the help of experts in occupational health nursing, by means of consensus techniques and applying validation rates. The final result is the ""ECOEnfTRA"" Scale¿ an evaluation tool made up of eight subscales, with criteria and levels of achievement, as well as the ""minimum level of achievement required"" for each one of them and for each year of training. The content validity and internal reliability of the rubrics that make up the ""ECOEnfTRA"" scale and the consensus for the minimum level of achievement required, which the RNIs must proof at the end of each residency year, have been achieved. A proposal for the implementation of this scale is also provided. This is a specific tool for these competences, which complements the general evaluation proposal contained in the Resolution of 21 March 2018, of the General-Directorate for Professional Regulation."
