,Spanish,English
0,La violencia en sus diversas variantes está presente en todos los ámbitos de la sociedad.,Violence in its several variations is present in all areas of society.
1,"Este fenómeno impacta a un alto por ciento de los niños en todo el mundo, tanto en países desarrollados, como en los que se presentan altos niveles de desigualdades entre sus habitantes y la paridad del poder adquisitivo.","This phenomenon impacts a high percentage of children worldwide, both in developed countries and in those with high levels of disparities among its people and obtaining power equality."
2,"La globalización y la continua búsqueda de las naciones por desarrollar tecnologías emergentes ha traído consigo grandes beneficios para la humanidad, prosperidad y trascendencia en las fronteras culturales.","Globalization and the continued quest of nations to develop emerging technologies has brought great benefits to humanity, prosperity, and transcendence on cultural boundaries."
3,"Asimismo, son estas nuevas tecnologías las que pueden llegar a fomentar las desigualdades, conductas antisociales y la legitimación de los actos de violencia entre iguales.","It is also these new technologies that can foster inequalities, anti-social behaviors, and the legitimization of acts of peer violence."
4,"La educación está en constante transmutación como consecuencia de los factores políticos, sociales, culturales y globales que permean sus contextos.","Education is constantly changing because of the political, social, cultural, and global factors that permeate its contexts."
5,"La investigación titulada: Estudio de la opinión de los futuros docentes sobre la violencia escolar y sus repercusiones en el ámbito de la educación superior: Estrategias de prevención e intervención; adviene ante las alarmantes cifras de violencia en los contextos escolares, no solo en Puerto Rico, también a nivel mundial.","Estudio de la opinión de los futuros docentes sobre la violencia escolar y sus repercusiones en el ámbito de la educación superior: Estrategias de prevención e intervención; comes because of the alarming number of violence events in school contexts, in Puerto Rico and globally."
6,Reconociendo la aventajada postura que exhibe el maestro en los escenarios escolares para la transformación de la vida de sus alumnos y la prevención de los actos de agresión y violencia pretendemos establecer la posible relación entre la violencia escolar y el nivel de capacitación que tiene el futuro profesorado para enfrentar situaciones de violencias en los ambientes escolares.,Recognizing the valuable attitude that teacher exhibits in school settings for the transformation of the lives of their students and the prevention of hostility acts and violence and the level of training that the future teachers have to face situations of violence in school environments.
7,"Asimismo, comprendan e implanten estrategias efectivas dirigidas a la prevención e intervención para combatir los actos violentos entre iguales; creando un ambiente seguro y de paz en la comunidad de aprendizaje.","They also include and implement effective strategies aimed at prevention and intervention to combat violent acts among the same, creating a safe and peaceful environment in the learning community."
8,"Esta tesis doctoral es un ensayo clínico que, en pacientes con infarto agudo de miocardio con elevación del segmento ST y enfermedad multivaso en los que se trata con éxito la arteria responsable del infarto mediante intervencionismo coronario, compara dos estrategias de revascularización de las lesiones no responsables del infarto.",This doctoral thesis is a clinical trial that compares two non-culprit vessel revascularization strategies in patients with ST segment elevation acute myocardial infarction and multivesel disease who have a successful percutaneous revascularization procedure in the infarct related artery.
9,Los pacientes fueron aleatorizados a revascularización percutánea de todas las lesiones no responsables del infarto en un segundo procedimiento (154 pacientes) o a realización de ecocardiograma de esfuerzo y revascularización sólo de las lesiones que mostraran isquemia miocárdica extensa (152 pacientes).,Patients were randomized to percutaneous revascularization of all non-infarct related coronary lesions in a second elective procedure (154 patients) or to a stress echocardiography and percutaneous revascularization of those coronary stenoses showing extensive myocardial isquemia (152 patients).
10,"El evento primario, el combinado de muerte cardiovascular, infarto agudo de miocardio, revascularización coronaria o reingreso por insuficiencia cardíaca tras 12 meses de seguimiento no mostró diferencias significativas entre las dos estrategias y tampoco cuando el seguimiento se extendió hasta un máximo de tres años.","The primary endpoint (the composite of cardiovascular death, myocardial infarction, coronary revascularization or readmission due to heart failure at 12 months follow-up) did not show any significant difference between study groups even when follow-up was extended up to three years."
11,En el grupo de revascularización guiada con ecocardiograma de esfuerzo se detectó isquemia miocárdica en 64 pacientes y en 44 se realizó un procedimiento de revascularización de alguna lesión no responsable del infarto.,Myocardial isquemia was detected in 64 patients randomized to stress echocardiography and in 44 patients of this study group a revascularization procedure in a non-infarct related coronary lesion was performed.
12,Los costes del tratamiento al alta hospitalaria y tras un año de seguimiento fueron significativamente menores en los pacientes aleatorizados a una estrategia de revascularización guiada con ecocardiograma de esfuerzo.,Medical expenses at hospital discharge and after one year follow-up were significantly lower in the stress echocardiography-guided revascularization strategy.
13,Los pabellones de conveniencia han tenido un profundo impacto en las actividades marítimas.,Flags of convenience have had a deep impact on maritime activities.
14,La ausencia de una regulación específica de este fenómeno y de una definición clara de la relación auténtica que debe existir entre un buque y su Estado de pabellón ha marcado su régimen jurídico.,The absence of specific provisions on this phenomenon and the lack of a clear definition of the genuine link that must exist between a ship and its flag State have left its footprint on its legal regime.
15,"Asimismo, ha motivado la adopción de múltiples tratados internacionales para abordar las consecuencias negativas de la utilización de pabellones de conveniencia y para tratar de matizar el principio de jurisdicción exclusiva del Estado de pabellón en alta mar.","Furthermore, it has led to the adoption of a plethora of international treaties dealing with the negative consequences of the use of flags of convenience and the qualification of the principle of exclusive flag State jurisdiction on the high seas."
16,"Sin embargo, uno de los problemas fundamentales relacionados con los pabellones de conveniencia, como es la falta de transparencia sobre la identidad del verdadero propietario del buque, permanece sin resolver.","However, one of the fundamental problems related to flags of convenience, namely the lack of transparency regarding the identity of the beneficial owner of the ship, remains unsolved."
17,"El objetivo de este trabajo es, por un lado, analizar las consecuencias de la interpretación de las disposiciones de Derecho internacional público sobre la nacionalidad y registro de los buques por los tribunales internacionales sobre los pabellones de conveniencia y, por otro lado, estudiar los esfuerzos para eliminar los efectos más perniciosos de la utilización de pabellones de conveniencia a través de la progresiva introducción de estándares para el ejercicio de la libertad de navegación y para desalentar las actividades ilícitas en el mar.","The purpose of this work is, on the one hand, to analyse the consequences of the interpretation of the International Law provisions on ship nationality and registration by international courts on flags of convenience, and, on the other hand, to examine the endeavours to eliminate the most pernicious effects of the use of flags of convenience through the progressive implementation of standards to exercise the freedom of navigation and to deter illegal activities at sea."
18,"Los seres humanos y los animales experimentan un desarrollo morfológico desde la infancia hasta la edad adulta, que tiene lugar en paralelo con el desa rrollo cognitivo.","Humans and animals undergo morphological development from infancy to adulthood, which takes place in parallel with cognitive development."
19,"De hecho, se ha demostrado que este proceso facilita el aprendizaje en los humanos.","In fact, this process has been shown to facilitate learning in humans."
20,"Sin embargo, la mayoría de los trabajos sobre robótica del desarrollo consideran morfologías fijas, abordando sólo el desarrollo del sistema cognitivo de los robots e ignorando la interacción entre el desarrollo cognitivo y el desarrollo morfológico.","However, most of the works on developmental robotics consider fixed morphologies, addressing only the development of the cognitive system of the robots and ignoring the interaction between cognitive development and morphological development."
21,"Además, los pocos casos encontrados en la literatura en que el desarrollo cognitivo y morfológico se abordan conjunta‐ mente en los sistemas robóticos presentan resultados bastante heterogéneos y no concluyentes en cuanto a las causas y los mecanismos que explican la in fluencia del desarrollo morfológico en el aprendizaje.","Moreover, the few cases found in the literature where cognitive and morphological development are jointly addressed in robotic systems present rather heterogeneous and inconclusive results regarding the causes and the mechanisms that explain the influence of morphological development on learning."
22,"En este trabajo se aborda el problema de la identificación de los rasgos del desarrollo morfológico que influyen en el aprendizaje, así como el cómo y el porqué de esta influencia.","This work addresses the problem of identifying those features of morphological development that influence learning, as well as how and why this influence comes about."
23,"Para ello, se ha diseñado un marco experimental simple y controlado basado en morfologías de robots con patas y se ha realizado una extensa serie de experimentos para intentar responder a estas preguntas.","To this end, a simple and controlled experimental framework based on legged robot morphologies has been designed and an extensive series of experiments have been run in order to try to answer these questions."
24,Las conclusiones obtenidas de este trabajo experimental han sido validadas mediante la aplicación con éxito en un robot bípedo de una estrategia de desarrollo morfológico diseñada a partir de los conocimientos obtenidos.,The conclusions obtained from this experimental work have been validated through the successful implementation on a bipedal robot of a morphological development strategy designed using the insights obtained.
25,Esto nos ha permitido plantear un conjunto inicial de principios de diseño que deberían aplicarse para producir procesos de desarrollo morfológico exitosos para problemas particulares.,This has allowed us to posit an initial set of design principles that should be applied in order to produce successful morphological development processes for particular problems.
26,La irrupción de los sistemas de derechos humanos a nivel constitucional genera consecuencias en el ámbito de las Administraciones Públicas y la ciudadanía.,"The irruption of human rights systems at a constitutional level, has consequences in the field of Public Administrations and the citizens."
27,La persona y su dignidad son la centralidad del Derecho Administrativo.,The person and his dignity are at the center of the Administrative Law.
28,Desde la mirada convergente de los derechos humanos construimos y fundamentamos un concepto propio del control de convencionalidad interno en doble dimensión: obligación estatal y garantía ciudadana.,"From the convergent perspective of human rights, we build and base our own concept of the control of internal conventionality in two dimensions: state obligation and citizen guarantee."
29,Junto al deber de garantía explican el rol preventivo de las Administraciones Públicas que complementa a las funciones clásicas.,Alongside the duty of guarantee explain the preventive role of Public Administrations that complements classical functions.
30,Este rol es expresión del deber de garantía genérico.,This role is an expression of the generic warranty duty.
31,"Aquellas protegen y promocionan los compromisos internacionales, toman la iniciativa para remover cualquier obstáculo a la efectividad de los derechos.","They protect and promote international commitments, take the initiative to remove any obstacles to the effectiveness of rights."
32,"La tutela administrativa efectiva, el derecho a los nuevos derechos y garantías, la cogestión del bienestar general desde lo deberes humanos de la ciudadanía, las nuevas dimensiones interpretativas, el salto cultural de la dimensión homogénea hacia la heterogénea en cuanto a reflejos de la diversidad existente en la composición de las sociedades y el ensanche del contenido de juridicidad, son algunas de las principales consecuencias tematizadas.","Effective administrative protection, the right to new rights and guarantees, the co-management of general well-being from the human duties of citizenship, the new interpretative dimensions, the cultural leap of the homogeneous dimension towards the heterogeneous in terms of reflections of the diversity existing in the composition of societies and the widening of the content of juridicity, are some of the main consequences mentioned."
33,"El control de convencionalidad interno es desplegado en la propia sede de las Administraciones Públicas, de manera simétrica y sinérgica con el control de constitucionalidad.","Internal conventionality control is deployed at the bases of the Public Administrations itself, symmetrically and synergistically with constitutionality control."
34,Desde hace varios años la privación de libertad y la expulsión son medidas que se utilizan de manera recurrente en la gestión de los flujos migratorios irregulares.,"For several years, deprivation of liberty and expulsion are measures used recurrently in the management of irregular migratory flows."
35,"Los espacios de detención más conocidos para este fin son los Centros de Internamiento de Extranjeros (CIE), pero también se utilizan otros lugares como las cárceles, las comisarías o las salas de inadmisión de los aeropuertos.","The most well-known places of detention for this purpose are the Centers for the Internment of Foreigners, but other places such as prisons, police stations or inadmissible rooms of airports are also used."
36,"Mediante este estudio se pretende conocer el proceso que viven las personas extranjeras extracomunitarias que son detenidas e internadas en cárceles y Centros de Internamiento de Extranjeros, así como la atención social que reciben.","The aim of this study is to understand the personal experience of non-EU foreigners who are detained and interned in prisons and Foreigners Internment Centers, as well as the social care they receive."
37,"Por tanto, el objetivo es investigar cómo se planifica la intervención social durante el internamiento, qué pronóstico se prevé tras la finalización de este y qué atención social se proporciona cuando se ejecuta la expulsión o tras comprobar la imposibilidad de su ejecución.","Therefore, the objective is to investigate how social intervention is planned during detention, what prognosis is expected after its completion and what social care is provided when expulsion is carried out or after verifying the impossibility of its execution."
38,"El grupo de población estudiado se considera un colectivo especialmente vulnerable, ya que al sufrir una privación de libertad aumenta el riesgo de exclusión social, la cual se agrava por la situación de irregularidad administrativa.","The population group studied is considered a particularly vulnerable group, which, when suffering a deprivation of liberty increases the risk of social exclusion."
39,"Por ello, la atención social es imprescindible durante el internamiento por ser una herramienta fundamental para paliar los efectos de este, pero también para la preparación para la vida en libertad, así como para acompañar durante esos primeros momentos.","For this reason, social care is essential during detention as because it is a fundamental tool to mitigate these effects and to prepare for life in freedom, as well as to accompany for during those first moments."
40,"No obstante, la premisa de la que parte esta investigación es la existencia de un subsistema policial, en el que la extranjería y la criminalidad se abordan conjuntamente.","However, the premise from which this investigation is based on is the existence of a police subsystem, in which foreigners and criminality are addressed together."
41,"Con este planteamiento, el espacio para la atención social y la detección de necesidades de esta población se condiciona a una interpretación rígida y restrictiva de derechos.","With this approach, the space for social care and the detection of needs of this population is conditioned to a strict and restrictive interpretation of rights."
42,"El estudio conjunto de los centros de internamiento y de las prisiones como lugares de encierro en los que la presencia de personas extranjeras extracomunitarias es muy elevada, pone de relieve las coincidencias y diferencias entre ambos dispositivos, pero también el papel que cada uno de ellos ostenta en las políticas de control de los flujos migratorios.","The joint study of internment centers and prisons as places of confinement, where the presence of non-EU foreigners is very high, highlights the coincidences and differences between the two devices, but also the role that each one of them plays in the control policies of migratory flows."
43,La regeneración del hueso y el cartílago tras sufrir un traumatismo o una enfermedad degenerativa continúa siendo un gran desafío clínico.,Regeneration of bone and cartilage after trauma or age-related degenerative diseases remains a major clinical challenge.
44,"Debido a su capacidad de auto-renovación y multi-diferenciación, las células mesenquimales estromales (MSC) son una fuente celular prometedora para la regeneración de estos tejidos, pero la investigación en este campo se ve limitada por la tendencia de las MSC a la senescencia en cultivo.","Due to their self-renewal and multi-differentiation potential, mesenchymal stromal cells (MSCs) are a promising cell source for bone and cartilage regeneration, but research on this field is impaired by MSCs’ predisposition to senescence when culture-expanded."
45,"La inmortalización de las MSC les permite superar la senescencia, impulsando así los avances en la investigación.","Immortalization of MSCs allows them to bypass senescence, thus boosting the advances in MSC research."
46,"En este estudio, se ha desarrollado un método para inmortalizar MSC derivadas de donantes de edad avanzada mediante inoculación centrífuga de dos genes de inmortalización: el antígeno T grande del virus de simio 40 (SV40LT) y la transcriptasa reversa de la telomerasa humana (hTERT).","In this study, a method has been developed to immortalize MSCs derived from elderly donors by spinoculation of two immortalization genes: simian virus 40 large T antigen (SV40LT) and human telomerase reverse transcriptase (hTERT)."
47,"Las MSC inmortalizadas son fenotípicamente similares a las MSC primarias y son capaces de diferenciarse hacia los tres linajes esqueléticos, aunque tienen tendencia a seguir la ruta de diferenciación osteogénica.","Immortalized MSCs are phenotypically similar to primary MSCs and are able to differentiate to the three skeletal lineages, although their multi-differentiation potential is unbalanced towards the osteogenic pathway."
48,"Los condrocitos articulares y los sinoviocitos se pueden inmortalizar utilizando el mismo método, pero los condrocitos inmortalizados son metabólicamente diferentes de los condrocitos articulares primarios.","Articular chondrocytes and synoviocytes can also be immortalized by the same method, but immortalized chondrocytes are metabolically different from primary articular chondrocytes."
49,Estas células pueden ser útiles como parte de modelos in vitro de regeneración de los tejidos articulares o de enfermedad osteocondral.,These immortalized cells can be useful as part of in vitro models of osteochondral regeneration and disease.
50,"En esta memoria se abordan diversos problemas de decisión que surgen en la gestión de proyectos, en la teoría de juegos cooperativos y en la optimización de rutas de vehículos.","This dissertation addresses sorne decision problems that arise in project management, cooperative game theory and vehicle route optimization."
51,Empezamos estudiando el problema del reparto de los costes de demora en un proyecto.,We start with the problem of allocating the delay costs of a project.
52,"En un contexto estocástico en el que suponemos que las duraciones de las actividades son variables aleatorias, proponemos y estudiamos una regla de reparto basada en el valor de Shapley.","In a stochastic context in which we assume that activity durations are random variables, we propose and study an allocation rule based on the Shapley value."
53,"Además, presentamos un paquete de R que permite un control integral del proyecto, incluyendo la nueva regla de reparto.","In addition, we present an R package that allows a comprehensive control of the project, including the new rule."
54,"A continuación, proponemos y caracterizamos axiomáticamente nuevas soluciones igualitarias en el contexto de los juegos cooperativos con una estructura coalicional.",We propose and characterize new egalitarian solutions in the context of cooperative games with a coalitional structure.
55,"E introducimos un nuevo valor, utilizando una propiedad de jugadores necesarios, para juegos cooperativos, que posteriormente extendemos y caracterizamos dentro del marco de los juegos cooperativos con una estructura coalicional.","Also, using a necessary player property we introduce a new value for cooperative games, which we later extend and characterize within the framework of cooperative games with a coalitional structure."
56,"Por último, presentamos un algoritmo en dos pasos para resolver problemas de rutas de vehículos con multi-compartimentos y demandas estocásticas.","Finally, we present a two-step algorithm for solving multi-compartment vehicle route problems with stochastic demands."
57,"Este algoritmo obtiene una solución inicial mediante una heurística constructiva y, a continuación, utiliza una búsqueda tabú para mejorar la solución.",This algorithm obtains an initial solution through a constructive heuristic and then uses a tabu search to improve the solution.
58,"Utilizando datos reales, llevamos a cabo un análisis del comportamiento del algoritmo.","Using real data, we evaluate the performance of the algorithm."
59,El transporte difusivo es un mecanismo fundamental en importantes procesos biológicos que incluyen reacciones químicas.,Diffusive transport is a fundamental mechanism in key biological processes involving chemical reactions.
60,"Sin embargo, las aproximaciones físico-estadísticas más habituales son incapaces de explicar satisfactoriamente la cinética de aquellos procesos reactivos que se ven fuertemente afectados por el crecimiento del medio en cuestión.","However, the most common statistical physics approaches fail to provide a satisfactory explanation for the kinetics of those reactive processes strongly affected by the growth of the embedding medium."
61,"Para aplicaciones en Biología y en otros ámbitos, resulta imprescindible elaborar modelos físico-estadísticos que describan apropiadamente el movimiento difusivo en medios expansivos.","For applications in biology and other fields, it is essential to develop statistical models which appropriately describe diffusion in expanding media."
62,"En muchas ocasiones, el movimiento de las partículas en los sistemas a estudiar satisface con bastante exactitud las leyes de la difusión browniana (también denominada difusión normal).","On many occasions, the motion of the particles in the systems under study follows rather accurately the laws of Brownian motion (also called normal diffusion)."
63,"Pero en otras, factores como el desorden del medio o la presencia de obstáculos que limitan el esparcimiento de las partículas introducen una mayor complejidad estadística en el transporte difusivo.","In other cases, though, features such as the medium disorder or the presence of obstacles hindering the dissemination of the particles introduce a higher complexity in the statistics of diffusive transport."
64,"Ello conduce a la llamada difusión anómala, frecuentemente modelada mediante la denominada Caminata Aleatoria en Tiempo Continuo.","This results in what is known as anomalous diffusion, which is frequently modeled via the so-called Continuous-Time Random Walk."
